[
  {
    "domain": "l.facebook.com",
    "type": "redirector",
    "status": "active",
    "added_at": "2026-02-20",
    "source": "internal",
    "evidence": [
      "https://developers.facebook.com/docs/sharing/webmasters"
    ],
    "notes": "Facebook link redirect / outbound click tracking"
  },
  {
    "domain": "l.instagram.com",
    "type": "redirector",
    "status": "active",
    "added_at": "2026-02-20",
    "source": "internal",
    "evidence": [
      "https://www.instagram.com/"
    ],
    "notes": "Instagram outbound link redirect"
  }
]
