[
  {
    "domain": "click.google-analytics.com",
    "type": "tracking",
    "status": "active",
    "added_at": "2026-02-20",
    "source": "internal",
    "evidence": [
      "https://developers.google.com/analytics"
    ],
    "notes": "Google Analytics click tracking"
  },
  {
    "domain": "click.linksynergy.com",
    "type": "tracking",
    "status": "active",
    "added_at": "2026-02-20",
    "source": "internal",
    "evidence": [
      "https://www.linksynergy.com/"
    ],
    "notes": "LinkShare / Rakuten affiliate tracking"
  },
  {
    "domain": "doubleclick.net",
    "type": "tracking",
    "status": "active",
    "added_at": "2026-02-20",
    "source": "internal",
    "evidence": [
      "https://www.google.com/doubleclick/"
    ],
    "notes": "Google advertising and conversion tracking"
  },
  {
    "domain": "tracking.truthfinder.com",
    "type": "tracking",
    "status": "active",
    "added_at": "2026-07-05",
    "source": "internal",
    "evidence": [
      "https://github.com/DontPokeMe/known-link-shorteners"
    ],
    "notes": "Restored from inactive list (re-probed 200)"
  }
]
